{
  "experiment_id": "E03_mock_visible_prefix_smoke",
  "prompt_version": "sentence-resampling-v0.1",
  "target_type": "synthetic_numerical_step",
  "semantic_arm_id": "mock_alternative",
  "continuation_mode": "visible_text_prefix_replay",
  "target_sentence_index": 3,
  "replacement_instruction": "Generate one alternative sentence that could occupy the selected reasoning step. Do not continue beyond that sentence.",
  "n_replacements": 2,
  "continuations_per_replacement": 3,
  "original_replay_continuations": 3,
  "require_verbatim_prefix": true,
  "require_exact_task_messages": true,
  "random_seed": 20260825,
  "backend": {
    "backend": "deterministic_mock",
    "model_id": "mock/sentence-resampler-v1",
    "provider": "local",
    "settings": {
      "temperature": 0.0,
      "mock_only": true
    }
  }
}
